### ISSUE TITLE
Does it work at arm (any success story)?

### ISSUE THREAD

**Issue by oleksandr-cynamics** [bbonev/eoip#39]
Hello,

I saw that "This code was tested and works without problems on quite a few different 32/64bit x86 systems."

Anyway any option to run it on CM4? I see eoip and gre (replaced) in lsmod, I have interface in a list

```
11: eoip0: <BROADCAST,MULTICAST,UP,LOWER_UP> mtu 1500 qdisc fq_codel state UNKNOWN group default qlen 1000
    link/ether 86:04:05:5b:70:1d brd ff:ff:ff:ff:ff:ff
    inet 10.10.25.200/24 scope global eoip0
       valid_lft forever preferred_lft forever
    inet6 fe80::8404:5ff:fe5b:701d/64 scope link 
       valid_lft forever preferred_lft forever
```

even some traffic at tcpdump

```
tcpdump -i eoip0
tcpdump: verbose output suppressed, use -v[v]... for full protocol decode
listening on eoip0, link-type EN10MB (Ethernet), snapshot length 262144 bytes
00:38:52.843904 STP 802.1w, Rapid STP, Flags [Proposal, Learn, Forward], bridge-id 8000.74:4d:28:dd:7a:89.8001, length 36
00:38:53.579724 IP 10.10.25.13.mdns > mdns.mcast.net.mdns: 19 [2q] PTR (QM)? _googlecast._tcp.local. PTR (QM)? _233637DE._sub._googlecast._tcp.local. (61)
00:38:53.579931 IP6 fe80::20d0:ddff:fe1f:167.mdns > ff02::fb.mdns: 19 [2q] PTR (QM)? _googlecast._tcp.local. PTR (QM)? _233637DE._sub._googlecast._tcp.local. (61)
00:38:54.845671 STP 802.1w, Rapid STP, Flags [Proposal, Learn, Forward], bridge-id 8000.74:4d:28:dd:7a:89.8001, length 36
00:38:56.843232 STP 802.1w, Rapid STP, Flags [Proposal, Learn, Forward], bridge-id 8000.74:4d:28:dd:7a:89.8001, length 36
00:38:58.845648 STP 802.1w, Rapid STP, Flags [Proposal, Learn, Forward], bridge-id 8000.74:4d:28:dd:7a:89.8001, length 36
00:39:00.844401 STP 802.1w, Rapid STP, Flags [Proposal, Learn, Forward], bridge-id 8000.74:4d:28:dd:7a:89.8001, length 36
00:39:02.274699 IP 10.10.25.254.5678 > 255.255.255.255.5678: UDP, length 148
00:39:02.274836 CDPv1, ttl: 121s, Device-ID 'ua-polt-r1'
          0x0000:  0000 0001 0101 cc00 040a 0a19 fe
          0x0000:  6272 6964 6765 2f65 6f69 702d 726f 6d61
          0x0010:  6e69 61
          0x0000:  0000 0001
          0x0000:  372e 3139 2e33 2028 7374 6162 6c65 2920
          0x0010:  3230 3235 2d30 372d 3033 2031 313a 3233
          0x0020:  3a30 34
          0x0000:  4d69 6b72 6f54 696b, length 117
00:39:02.275055 LLDP, length 147: ua-polt-r1
00:39:02.847367 STP 802.1w, Rapid STP, Flags [Proposal, Learn, Forward], bridge-id 8000.74:4d:28:dd:7a:89.8001, length 36
```

but no ping, no dhcp. iface at mikrotik bridged to "local" network

**Comment by bbonev** [comment]
There is no reason `eoip` not to work on ARM.

It is highly unlikely, but still possible, `eoip` to fail on a big-endian arch. But ARM is little endian, and everything should work.

I am closing this, if there are more things to report, please update and/or reopen.
