### ISSUE TITLE
eoip interface and nftables

### ISSUE THREAD

**Issue by mo3r31337** [bbonev/eoip#38]
Hello, did anyone manage to use an EOIP integration and NFTables?
If I put a default policy in DROP, I stop getting ARP answers. It looks like NFTables believes that there should not be ARP on this type of network device and throws these packets.
I can’t understand how to overcome this, the request leaves but I do not get an answer, it simply does not go on the network inteface, but as soon as I turn off nftables everything will work.

When the nftables enabled:
```tcpdump -i mkrt-gw-eoip1 -n
tcpdump: verbose output suppressed, use -v[v]... for full protocol decode
listening on mkrt-gw-eoip1, link-type EN10MB (Ethernet), snapshot length 262144 bytes

15:58:26.754850 ARP, Request who-has 192.168.0.2 tell 192.168.0.1, length 28
15:58:27.770867 ARP, Request who-has 192.168.0.2 tell 192.168.0.1, length 28
15:58:28.794888 ARP, Request who-has 192.168.0.2 tell 192.168.0.1, length 28
15:58:29.819398 ARP, Request who-has 192.168.0.2 tell 192.168.0.1, length 28
15:58:30.842936 ARP, Request who-has 192.168.0.2 tell 192.168.0.1, length 28
15:58:31.866896 ARP, Request who-has 192.168.0.2 tell 192.168.0.1, length 28
```

Just switch off:
```tcpdump -i mkrt-gw-eoip1 -n
tcpdump: verbose output suppressed, use -v[v]... for full protocol decode
listening on mkrt-gw-eoip1, link-type EN10MB (Ethernet), snapshot length 262144 bytes
15:59:53.874634 ARP, Request who-has 192.168.0.2 tell 192.168.0.1, length 28
15:59:53.925944 ARP, Reply 192.168.0.2 is-at 74:4d:28:08:f0:95, length 28
15:59:53.925971 IP 192.168.0.1 > 192.168.0.2: ICMP echo request, id 63179, seq 1, length 64
15:59:53.976173 IP 192.168.0.2 > 192.168.0.1: ICMP echo reply, id 63179, seq 1, length 64
15:59:54.875887 IP 192.168.0.1 > 192.168.0.2: ICMP echo request, id 63179, seq 2, length 64
15:59:54.929551 IP 192.168.0.2 > 192.168.0.1: ICMP echo reply, id 63179, seq 2, length 64
```

At this time, the EOIP tunnel itself in the established state and the exchange of GREs, the protocol occurs between the router and the Linux server without problems, I see that GRE packets comes and leaves. I also tried to create rules for ARP traffic in ARP, NetDev, Bridge tables Firewall, no effect.
Perhaps I need to somehow put HOOK in a special way?

My system:
```uname -srvmpio
Linux 6.8.0-60-generic #63-Ubuntu SMP PREEMPT_DYNAMIC Tue Apr 15 19:04:15 UTC 2025 x86_64 x86_64 x86_64 GNU/Linux
nft --version
nftables v1.0.9 (Old Doc Yak #31 
```

And latest version of eoip code from git

Thanks for any advice on resolving my problem!

**Comment by bbonev** [comment]
Without seeing your nftables rule-set, anything said is a wild, uneducated guess.

Here is mine - this has nothing to do with the EoIP interface itself, your nftables rule-set is dropping the encapsulated EoIP traffic btween `local <ip>` and `remote <ip>`...

**Comment by mo3r31337** [comment]
Yes, you were right, the rule for the GRE of traffic from the drop-in file of the nftables configuration is added, but does not work.
```
ip protocol { gre, esp, ah } accept comment "Accept AH and ESP protocols"
```
Very strange. At the same time, the GRE tunnel works on the same server.

Sorry, this is really not the problem of the EOIP module.
Thanks for the hint, I was tormented for more than one month with this, but for some reason I did not pay attention to this.
